{
  "generated_at": "2026-10-17T17:00:05.828864Z",
  "date": "2025-09-09",
  "pipeline_version": "1.0.0",
  "counts": {
    "events": 4,
    "critical": 0,
    "high": 0,
    "medium": 0,
    "low": 0,
    "unknown": 4,
    "directly_reported_in_au": 0,
    "pending_enrichment": 4
  },
  "events": [
    {
      "event_id": "evt-2026-002886",
      "schema_version": "1",
      "pipeline_version": "1.0.0",
      "scoring_version": "3",
      "enrichment_version": "0",
      "first_seen": "2025-09-09T10:00:00Z",
      "last_seen": "2026-10-17T16:00:00.102989Z",
      "last_material_update": "2025-09-09T10:00:00Z",
      "last_independent_confirmation": null,
      "status": "archived",
      "title": "SafetyKit scales risk agents with OpenAI’s most capable models",
      "summary": "Discover how SafetyKit leverages OpenAI GPT-5 to enhance content moderation, enforce compliance, and outpace legacy safety systems with greater accuracy .",
      "why_it_matters": null,
      "resolution": null,
      "domains": [
        "ai"
      ],
      "categories": [
        "ai_security"
      ],
      "ai_subdomain": null,
      "ai_significance": null,
      "severity": "unknown",
      "severity_source": "unknown",
      "risk": {
        "urgency": 0.2727272727272727,
        "confidence": 0.6,
        "novelty": 2.8987350614070243e-59,
        "prominence": 1.476832022610189e-118
      },
      "au": {
        "relevance": null,
        "directly_reported_in_au": false,
        "reasons": [],
        "sectors": [],
        "soci_asset_classes": []
      },
      "entities": {
        "actors": [],
        "organisations": [],
        "products": [],
        "countries": [],
        "industries": []
      },
      "cves": [],
      "mitre_techniques": [],
      "claims": [],
      "sources": [
        {
          "source_id": "openai_news",
          "url": "https://openai.com/index/safetykit",
          "published": "2025-09-09T10:00:00Z",
          "evidence_class": "SPECIALIST",
          "lineage_id": "openai_news",
          "independent": true
        }
      ],
      "timeline": [
        {
          "timestamp": "2025-09-09T10:00:00Z",
          "type": "NEW_FACT",
          "summary": "First reported by OpenAI News",
          "sources": [
            "openai_news"
          ]
        }
      ],
      "relationships": [],
      "tags": [],
      "pending_enrichment": true,
      "importance": {
        "version": "1",
        "score": 13,
        "tier": "routine",
        "reasons": [
          "reported by OpenAI News (specialist)"
        ]
      },
      "beat": "ai"
    },
    {
      "event_id": "evt-2026-003875",
      "schema_version": "1",
      "pipeline_version": "1.0.0",
      "scoring_version": "3",
      "enrichment_version": "0",
      "first_seen": "2025-09-09T00:00:00Z",
      "last_seen": "2026-10-16T16:00:00.190710Z",
      "last_material_update": "2025-09-09T00:00:00Z",
      "last_independent_confirmation": null,
      "status": "archived",
      "title": "mmBERT: ModernBERT goes Multilingual",
      "summary": "mmBERT: ModernBERT goes Multilingual",
      "why_it_matters": null,
      "resolution": null,
      "domains": [
        "ai"
      ],
      "categories": [
        "ai_security"
      ],
      "ai_subdomain": null,
      "ai_significance": null,
      "severity": "unknown",
      "severity_source": "unknown",
      "risk": {
        "urgency": 0.2727272727272727,
        "confidence": 0.6,
        "novelty": 2.50896117631815e-59,
        "prominence": 1.1063739354174602e-118
      },
      "au": {
        "relevance": null,
        "directly_reported_in_au": false,
        "reasons": [],
        "sectors": [],
        "soci_asset_classes": []
      },
      "entities": {
        "actors": [],
        "organisations": [],
        "products": [],
        "countries": [],
        "industries": []
      },
      "cves": [],
      "mitre_techniques": [],
      "claims": [],
      "sources": [
        {
          "source_id": "huggingface",
          "url": "https://huggingface.co/blog/mmbert",
          "published": "2025-09-09T00:00:00Z",
          "evidence_class": "SPECIALIST",
          "lineage_id": "huggingface",
          "independent": true
        }
      ],
      "timeline": [
        {
          "timestamp": "2025-09-09T00:00:00Z",
          "type": "NEW_FACT",
          "summary": "First reported by Hugging Face Blog",
          "sources": [
            "huggingface"
          ]
        }
      ],
      "relationships": [],
      "tags": [],
      "pending_enrichment": true,
      "importance": {
        "version": "1",
        "score": 13,
        "tier": "routine",
        "reasons": [
          "reported by Hugging Face Blog (specialist)"
        ]
      },
      "beat": "ai"
    },
    {
      "event_id": "evt-2026-005322",
      "schema_version": "1",
      "pipeline_version": "1.0.0",
      "scoring_version": "4",
      "enrichment_version": "0",
      "first_seen": "2025-09-09T07:00:00Z",
      "last_seen": "2026-10-10T04:00:00.140919Z",
      "last_material_update": "2025-09-09T07:00:00Z",
      "last_independent_confirmation": null,
      "status": "archived",
      "title": "Microsoft September 2025 Security Updates",
      "summary": "Microsoft September 2025 Security Updates",
      "why_it_matters": null,
      "resolution": null,
      "domains": [
        "cybersecurity"
      ],
      "categories": [
        "vendor_advisory"
      ],
      "ai_subdomain": null,
      "ai_significance": null,
      "severity": "unknown",
      "severity_source": "unknown",
      "risk": {
        "urgency": 0.2727272727272727,
        "confidence": 0.75,
        "novelty": 1.1670960709405935e-59,
        "prominence": 2.3940172075966154e-119
      },
      "au": {
        "relevance": null,
        "directly_reported_in_au": false,
        "reasons": [],
        "sectors": [],
        "soci_asset_classes": []
      },
      "entities": {
        "actors": [],
        "organisations": [],
        "products": [],
        "countries": [],
        "industries": []
      },
      "cves": [],
      "mitre_techniques": [],
      "claims": [],
      "sources": [
        {
          "source_id": "msrc_cvrf",
          "url": "https://msrc.microsoft.com/update-guide/releaseNote/2025-Sep",
          "published": "2025-09-09T07:00:00Z",
          "evidence_class": "VENDOR",
          "lineage_id": "microsoft",
          "independent": true
        }
      ],
      "timeline": [
        {
          "timestamp": "2025-09-09T07:00:00Z",
          "type": "NEW_FACT",
          "summary": "First reported by Microsoft Security Updates",
          "sources": [
            "msrc_cvrf"
          ]
        }
      ],
      "relationships": [],
      "tags": [],
      "pending_enrichment": true,
      "importance": {
        "version": "1",
        "score": 23,
        "tier": "routine",
        "reasons": [
          "reported by Microsoft (authoritative)"
        ]
      },
      "beat": "cyber"
    },
    {
      "event_id": "evt-2026-006504",
      "schema_version": "1",
      "pipeline_version": "1.0.0",
      "scoring_version": "4",
      "enrichment_version": "0",
      "first_seen": "2025-09-09T00:00:00Z",
      "last_seen": "2026-10-17T16:00:00.102989Z",
      "last_material_update": "2025-09-09T00:00:00Z",
      "last_independent_confirmation": null,
      "status": "archived",
      "title": "Choosing the Right Crypto Wallet: From Apps to Hardware",
      "summary": "Choosing the Right Crypto Wallet: From Apps to Hardware",
      "why_it_matters": null,
      "resolution": null,
      "domains": [
        "cybersecurity"
      ],
      "categories": [
        "community"
      ],
      "ai_subdomain": null,
      "ai_significance": null,
      "severity": "unknown",
      "severity_source": "unknown",
      "risk": {
        "urgency": 0.2727272727272727,
        "confidence": 0.3,
        "novelty": 9.95682054280942e-60,
        "prominence": 1.742430293533114e-119
      },
      "au": {
        "relevance": null,
        "directly_reported_in_au": false,
        "reasons": [],
        "sectors": [],
        "soci_asset_classes": []
      },
      "entities": {
        "actors": [],
        "organisations": [],
        "products": [],
        "countries": [],
        "industries": []
      },
      "cves": [],
      "mitre_techniques": [],
      "claims": [],
      "sources": [
        {
          "source_id": "found_plainenglish_io",
          "url": "https://plainenglish.io/cryptocurrency/choosing-the-right-crypto-wallet-from-apps-to-hardware",
          "published": "2025-09-09T00:00:00Z",
          "evidence_class": "COMMUNITY",
          "lineage_id": "found_plainenglish_io",
          "independent": true
        }
      ],
      "timeline": [
        {
          "timestamp": "2025-09-09T00:00:00Z",
          "type": "NEW_FACT",
          "summary": "First reported by In Plain English",
          "sources": [
            "found_plainenglish_io"
          ]
        }
      ],
      "relationships": [],
      "tags": [],
      "pending_enrichment": true,
      "importance": {
        "version": "1",
        "score": 10,
        "tier": "routine",
        "reasons": [
          "reported by In Plain English (community)"
        ]
      },
      "beat": "cyber"
    }
  ]
}
