{
  "generated_at": "2026-10-17T17:00:05.828864Z",
  "date": "2021-03-25",
  "pipeline_version": "1.0.0",
  "counts": {
    "events": 0,
    "critical": 0,
    "high": 0,
    "medium": 0,
    "low": 0,
    "unknown": 0,
    "directly_reported_in_au": 0,
    "pending_enrichment": 0
  },
  "events": []
}
