{
  "generated_at": "2026-10-17T17:00:05.828864Z",
  "date": "2026-01-03",
  "pipeline_version": "1.0.0",
  "counts": {
    "events": 3,
    "critical": 0,
    "high": 0,
    "medium": 0,
    "low": 0,
    "unknown": 3,
    "directly_reported_in_au": 0,
    "pending_enrichment": 3
  },
  "events": [
    {
      "event_id": "evt-2026-006343",
      "schema_version": "1",
      "pipeline_version": "1.0.0",
      "scoring_version": "4",
      "enrichment_version": "0",
      "first_seen": "2026-01-03T11:16:40Z",
      "last_seen": "2026-10-17T16:00:00.102989Z",
      "last_material_update": "2026-01-03T11:16:40Z",
      "last_independent_confirmation": null,
      "status": "archived",
      "title": "5 Python Scripts I Wrote for Fun That Accidentally Went Viral",
      "summary": "5 Python Scripts I Wrote for Fun That Accidentally Went Viral",
      "why_it_matters": null,
      "resolution": null,
      "domains": [
        "cybersecurity"
      ],
      "categories": [
        "community"
      ],
      "ai_subdomain": null,
      "ai_significance": null,
      "severity": "unknown",
      "severity_source": "unknown",
      "risk": {
        "urgency": 0.2727272727272727,
        "confidence": 0.3,
        "novelty": 3.377446983936229e-42,
        "prominence": 2.0048927015133207e-84
      },
      "au": {
        "relevance": null,
        "directly_reported_in_au": false,
        "reasons": [],
        "sectors": [],
        "soci_asset_classes": []
      },
      "entities": {
        "actors": [],
        "organisations": [],
        "products": [],
        "countries": [],
        "industries": []
      },
      "cves": [],
      "mitre_techniques": [],
      "claims": [],
      "sources": [
        {
          "source_id": "found_plainenglish_io",
          "url": "https://plainenglish.io/artificial-intelligence/5-python-scripts-i-wrote-for-fun-that-accidentally-went-viral",
          "published": "2026-01-03T11:16:40Z",
          "evidence_class": "COMMUNITY",
          "lineage_id": "found_plainenglish_io",
          "independent": true
        }
      ],
      "timeline": [
        {
          "timestamp": "2026-01-03T11:16:40Z",
          "type": "NEW_FACT",
          "summary": "First reported by In Plain English",
          "sources": [
            "found_plainenglish_io"
          ]
        }
      ],
      "relationships": [],
      "tags": [],
      "pending_enrichment": true,
      "importance": {
        "version": "1",
        "score": 10,
        "tier": "routine",
        "reasons": [
          "reported by In Plain English (community)"
        ]
      },
      "beat": "cyber"
    },
    {
      "event_id": "evt-2026-006344",
      "schema_version": "1",
      "pipeline_version": "1.0.0",
      "scoring_version": "4",
      "enrichment_version": "0",
      "first_seen": "2026-01-03T04:09:55Z",
      "last_seen": "2026-10-17T16:00:00.102989Z",
      "last_material_update": "2026-01-03T04:09:55Z",
      "last_independent_confirmation": null,
      "status": "archived",
      "title": "Is Finelo Legit? What 17,000+ Reviews Actually Say",
      "summary": "Is Finelo Legit? What 17,000+ Reviews Actually Say",
      "why_it_matters": null,
      "resolution": null,
      "domains": [
        "cybersecurity"
      ],
      "categories": [
        "community"
      ],
      "ai_subdomain": null,
      "ai_significance": null,
      "severity": "unknown",
      "severity_source": "unknown",
      "risk": {
        "urgency": 0.2727272727272727,
        "confidence": 0.3,
        "novelty": 3.047774238528308e-42,
        "prominence": 1.6325994331034384e-84
      },
      "au": {
        "relevance": null,
        "directly_reported_in_au": false,
        "reasons": [],
        "sectors": [],
        "soci_asset_classes": []
      },
      "entities": {
        "actors": [],
        "organisations": [],
        "products": [],
        "countries": [],
        "industries": []
      },
      "cves": [],
      "mitre_techniques": [],
      "claims": [],
      "sources": [
        {
          "source_id": "found_plainenglish_io",
          "url": "https://plainenglish.io/business/is-finelo-legit-what-17-000-reviews-actually-say",
          "published": "2026-01-03T04:09:55Z",
          "evidence_class": "COMMUNITY",
          "lineage_id": "found_plainenglish_io",
          "independent": true
        }
      ],
      "timeline": [
        {
          "timestamp": "2026-01-03T04:09:55Z",
          "type": "NEW_FACT",
          "summary": "First reported by In Plain English",
          "sources": [
            "found_plainenglish_io"
          ]
        }
      ],
      "relationships": [],
      "tags": [],
      "pending_enrichment": true,
      "importance": {
        "version": "1",
        "score": 10,
        "tier": "routine",
        "reasons": [
          "reported by In Plain English (community)"
        ]
      },
      "beat": "cyber"
    },
    {
      "event_id": "evt-2026-006345",
      "schema_version": "1",
      "pipeline_version": "1.0.0",
      "scoring_version": "4",
      "enrichment_version": "0",
      "first_seen": "2026-01-03T04:08:41Z",
      "last_seen": "2026-10-17T16:00:00.102989Z",
      "last_material_update": "2026-01-03T04:08:41Z",
      "last_independent_confirmation": null,
      "status": "archived",
      "title": "Coursiv Review 2025-2026: Practical AI Skills for Non-Technical Professionals",
      "summary": "Coursiv Review 2025-2026: Practical AI Skills for Non-Technical Professionals",
      "why_it_matters": null,
      "resolution": null,
      "domains": [
        "cybersecurity"
      ],
      "categories": [
        "community"
      ],
      "ai_subdomain": null,
      "ai_significance": null,
      "severity": "unknown",
      "severity_source": "unknown",
      "risk": {
        "urgency": 0.2727272727272727,
        "confidence": 0.3,
        "novelty": 3.0468696901873626e-42,
        "prominence": 1.6316304991544883e-84
      },
      "au": {
        "relevance": null,
        "directly_reported_in_au": false,
        "reasons": [],
        "sectors": [],
        "soci_asset_classes": []
      },
      "entities": {
        "actors": [],
        "organisations": [],
        "products": [],
        "countries": [],
        "industries": []
      },
      "cves": [],
      "mitre_techniques": [],
      "claims": [],
      "sources": [
        {
          "source_id": "found_plainenglish_io",
          "url": "https://plainenglish.io/artificial-intelligence/coursiv-review-2025-2026-practical-ai-skills-for-non-technical-professionals",
          "published": "2026-01-03T04:08:41Z",
          "evidence_class": "COMMUNITY",
          "lineage_id": "found_plainenglish_io",
          "independent": true
        }
      ],
      "timeline": [
        {
          "timestamp": "2026-01-03T04:08:41Z",
          "type": "NEW_FACT",
          "summary": "First reported by In Plain English",
          "sources": [
            "found_plainenglish_io"
          ]
        }
      ],
      "relationships": [],
      "tags": [],
      "pending_enrichment": true,
      "importance": {
        "version": "1",
        "score": 10,
        "tier": "routine",
        "reasons": [
          "reported by In Plain English (community)"
        ]
      },
      "beat": "cyber"
    }
  ]
}
