{
  "generated_at": "2026-10-17T17:00:05.828864Z",
  "date": "2026-07-04",
  "pipeline_version": "1.0.0",
  "counts": {
    "events": 2,
    "critical": 0,
    "high": 0,
    "medium": 0,
    "low": 0,
    "unknown": 2,
    "directly_reported_in_au": 0,
    "pending_enrichment": 2
  },
  "events": [
    {
      "event_id": "evt-2026-005782",
      "schema_version": "1",
      "pipeline_version": "1.0.0",
      "scoring_version": "4",
      "enrichment_version": "0",
      "first_seen": "2026-07-04T16:04:27Z",
      "last_seen": "2026-10-17T16:00:00.102989Z",
      "last_material_update": "2026-07-04T16:04:27Z",
      "last_independent_confirmation": null,
      "status": "archived",
      "title": "How to Make the Most of Online Gaming Bonuses",
      "summary": "How to Make the Most of Online Gaming Bonuses",
      "why_it_matters": null,
      "resolution": null,
      "domains": [
        "cybersecurity"
      ],
      "categories": [
        "community"
      ],
      "ai_subdomain": null,
      "ai_significance": null,
      "severity": "unknown",
      "severity_source": "unknown",
      "risk": {
        "urgency": 0.2727272727272727,
        "confidence": 0.3,
        "novelty": 8.961867087459307e-15,
        "prominence": 1.411598054003225e-29
      },
      "au": {
        "relevance": null,
        "directly_reported_in_au": false,
        "reasons": [],
        "sectors": [],
        "soci_asset_classes": []
      },
      "entities": {
        "actors": [],
        "organisations": [],
        "products": [],
        "countries": [],
        "industries": []
      },
      "cves": [],
      "mitre_techniques": [],
      "claims": [],
      "sources": [
        {
          "source_id": "found_plainenglish_io",
          "url": "https://plainenglish.io/gaming/how-to-make-the-most-of-online-gaming-bonuses",
          "published": "2026-07-04T16:04:27Z",
          "evidence_class": "COMMUNITY",
          "lineage_id": "found_plainenglish_io",
          "independent": true
        }
      ],
      "timeline": [
        {
          "timestamp": "2026-07-04T16:04:27Z",
          "type": "NEW_FACT",
          "summary": "First reported by In Plain English",
          "sources": [
            "found_plainenglish_io"
          ]
        }
      ],
      "relationships": [],
      "tags": [],
      "pending_enrichment": true,
      "importance": {
        "version": "1",
        "score": 10,
        "tier": "routine",
        "reasons": [
          "reported by In Plain English (community)"
        ]
      },
      "beat": "cyber"
    },
    {
      "event_id": "evt-2026-005783",
      "schema_version": "1",
      "pipeline_version": "1.0.0",
      "scoring_version": "4",
      "enrichment_version": "0",
      "first_seen": "2026-07-04T13:50:00Z",
      "last_seen": "2026-10-17T16:00:00.102989Z",
      "last_material_update": "2026-07-04T13:50:00Z",
      "last_independent_confirmation": null,
      "status": "archived",
      "title": "1,500 Applications, 35 Interviews, and a 2.3% Success Rate: My Post-Mortem of the Tech Market.",
      "summary": "1,500 Applications, 35 Interviews, and a 2.3% Success Rate: My Post-Mortem of the Tech Market.",
      "why_it_matters": null,
      "resolution": null,
      "domains": [
        "cybersecurity"
      ],
      "categories": [
        "community"
      ],
      "ai_subdomain": null,
      "ai_significance": null,
      "severity": "unknown",
      "severity_source": "unknown",
      "risk": {
        "urgency": 0.2727272727272727,
        "confidence": 0.3,
        "novelty": 8.676512683279765e-15,
        "prominence": 1.3231359381517214e-29
      },
      "au": {
        "relevance": null,
        "directly_reported_in_au": false,
        "reasons": [],
        "sectors": [],
        "soci_asset_classes": []
      },
      "entities": {
        "actors": [],
        "organisations": [],
        "products": [],
        "countries": [],
        "industries": []
      },
      "cves": [],
      "mitre_techniques": [],
      "claims": [],
      "sources": [
        {
          "source_id": "found_plainenglish_io",
          "url": "https://plainenglish.io/software-development/1-500-applications-35-interviews-and-a-2-3-success-rate-my-post-mortem-of-the-tech-market",
          "published": "2026-07-04T13:50:00Z",
          "evidence_class": "COMMUNITY",
          "lineage_id": "found_plainenglish_io",
          "independent": true
        }
      ],
      "timeline": [
        {
          "timestamp": "2026-07-04T13:50:00Z",
          "type": "NEW_FACT",
          "summary": "First reported by In Plain English",
          "sources": [
            "found_plainenglish_io"
          ]
        }
      ],
      "relationships": [],
      "tags": [],
      "pending_enrichment": true,
      "importance": {
        "version": "1",
        "score": 10,
        "tier": "routine",
        "reasons": [
          "reported by In Plain English (community)"
        ]
      },
      "beat": "cyber"
    }
  ]
}
