{
  "generated_at": "2026-10-17T17:00:05.828864Z",
  "date": "2025-08-16",
  "pipeline_version": "1.0.0",
  "counts": {
    "events": 2,
    "critical": 0,
    "high": 0,
    "medium": 0,
    "low": 0,
    "unknown": 2,
    "directly_reported_in_au": 0,
    "pending_enrichment": 2
  },
  "events": [
    {
      "event_id": "evt-2026-004566",
      "schema_version": "1",
      "pipeline_version": "1.0.0",
      "scoring_version": "3",
      "enrichment_version": "0",
      "first_seen": "2025-08-16T19:20:58Z",
      "last_seen": "2026-10-14T00:00:00.167039Z",
      "last_material_update": "2025-08-16T19:20:58Z",
      "last_independent_confirmation": null,
      "status": "archived",
      "title": "Amp Code: Invisible Prompt Injection Fixed by Sourcegraph",
      "summary": "In this post we will look at Amp, a coding agent from Sourcegraph. The other day we discussed how invisible instructions impact Google Jules . Turns out that many client applications are vulnerable to these kinds of attacks when they use models that support invisible instructions, like Claude. Invisible Unicode Tag Characters Interpreted as Instructions We have talked about hidden prompt injections quite a bit in the past , and so I’m keeping this short.",
      "why_it_matters": null,
      "resolution": null,
      "domains": [
        "cybersecurity",
        "ai"
      ],
      "categories": [
        "research"
      ],
      "ai_subdomain": null,
      "ai_significance": null,
      "severity": "unknown",
      "severity_source": "unknown",
      "risk": {
        "urgency": 0.2727272727272727,
        "confidence": 0.6,
        "novelty": 8.099966560857306e-63,
        "prominence": 1.1531359335292058e-125
      },
      "au": {
        "relevance": null,
        "directly_reported_in_au": false,
        "reasons": [],
        "sectors": [],
        "soci_asset_classes": []
      },
      "entities": {
        "actors": [],
        "organisations": [],
        "products": [],
        "countries": [],
        "industries": []
      },
      "cves": [],
      "mitre_techniques": [],
      "claims": [],
      "sources": [
        {
          "source_id": "embracethered",
          "url": "https://embracethered.com/blog/posts/2025/amp-code-fixed-invisible-prompt-injection/",
          "published": "2025-08-16T19:20:58Z",
          "evidence_class": "SPECIALIST",
          "lineage_id": "embracethered",
          "independent": true
        }
      ],
      "timeline": [
        {
          "timestamp": "2025-08-16T19:20:58Z",
          "type": "NEW_FACT",
          "summary": "First reported by Embrace The Red",
          "sources": [
            "embracethered"
          ]
        }
      ],
      "relationships": [],
      "tags": [],
      "pending_enrichment": true,
      "importance": {
        "version": "1",
        "score": 18,
        "tier": "routine",
        "reasons": [
          "reported by Embrace The Red (specialist)",
          "cyber and AI"
        ]
      },
      "beat": "both"
    },
    {
      "event_id": "evt-2026-006535",
      "schema_version": "1",
      "pipeline_version": "1.0.0",
      "scoring_version": "4",
      "enrichment_version": "0",
      "first_seen": "2025-08-16T00:00:00Z",
      "last_seen": "2026-10-17T16:00:00.102989Z",
      "last_material_update": "2025-08-16T00:00:00Z",
      "last_independent_confirmation": null,
      "status": "archived",
      "title": "11 AI Chatbot Commands So Good, They Should Be Illegal",
      "summary": "These commands feel like cheat codes once you know them, building chatbots gets unfairly easy.",
      "why_it_matters": null,
      "resolution": null,
      "domains": [
        "cybersecurity"
      ],
      "categories": [
        "community"
      ],
      "ai_subdomain": null,
      "ai_significance": null,
      "severity": "unknown",
      "severity_source": "unknown",
      "risk": {
        "urgency": 0.2727272727272727,
        "confidence": 0.3,
        "novelty": 2.430864390334331e-63,
        "prominence": 1.0385693869192087e-126
      },
      "au": {
        "relevance": null,
        "directly_reported_in_au": false,
        "reasons": [],
        "sectors": [],
        "soci_asset_classes": []
      },
      "entities": {
        "actors": [],
        "organisations": [],
        "products": [],
        "countries": [],
        "industries": []
      },
      "cves": [],
      "mitre_techniques": [],
      "claims": [],
      "sources": [
        {
          "source_id": "found_plainenglish_io",
          "url": "https://plainenglish.io/chatbots/11-ai-chatbot-commands-so-good-they-should-be-illegal",
          "published": "2025-08-16T00:00:00Z",
          "evidence_class": "COMMUNITY",
          "lineage_id": "found_plainenglish_io",
          "independent": true
        }
      ],
      "timeline": [
        {
          "timestamp": "2025-08-16T00:00:00Z",
          "type": "NEW_FACT",
          "summary": "First reported by In Plain English",
          "sources": [
            "found_plainenglish_io"
          ]
        }
      ],
      "relationships": [],
      "tags": [],
      "pending_enrichment": true,
      "importance": {
        "version": "1",
        "score": 10,
        "tier": "routine",
        "reasons": [
          "reported by In Plain English (community)"
        ]
      },
      "beat": "cyber"
    }
  ]
}
